{
  "schema_version": 1,
  "name": "tv32",
  "application_id": "com.example.arcp",
  "deployment_mode": "first_install",
  "android_identity": { "manufacturer": "Example", "model": "TV", "device": "tv", "min_sdk": 21, "max_sdk": 34, "abi_any_of": ["armeabi-v7a"] },
  "capabilities": { "fallback_tunnel": false, "pin_provisioning": false, "first_install": true, "require_32bit": true },
  "paths": { "android_config": "android/config.json", "apply": "android/apply-config.sh", "verify": "scripts/verify.sh", "secrets": ".env.secrets" }
}
